[
  {
    "region_code": "320100",
    "region": "南京市",
    "level": "市",
    "year": 2024,
    "category": "经济",
    "subcategory": "经济总量",
    "indicator": "地区生产总值(GDP)",
    "nature": "实际值",
    "value": 18500.81,
    "unit": "亿元",
    "yoy": "4.5%",
    "deadline": "",
    "responsible": "",
    "source": "2024年南京市国民经济和社会发展统计公报",
    "doc_no": "—（公开统计公报）",
    "source_url": "https://tjj.nanjing.gov.cn/bmfw/njsj/202504/t20250401_5108490.html",
    "note": "官方统计公报补录",
    "compare_key": "GDP",
    "region_tier": "3·副省级城市"
  },
  {
    "region_code": "320100",
    "region": "南京市",
    "level": "市",
    "year": 2024,
    "category": "经济",
    "subcategory": "经济总量",
    "indicator": "人均GDP",
    "nature": "实际值",
    "value": 193483,
    "unit": "元",
    "yoy": "4.0%",
    "deadline": "",
    "responsible": "",
    "source": "2024年南京市国民经济和社会发展统计公报",
    "doc_no": "—（公开统计公报）",
    "source_url": "https://tjj.nanjing.gov.cn/bmfw/njsj/202504/t20250401_5108490.html",
    "note": "官方统计公报补录",
    "compare_key": "人均GDP",
    "region_tier": "3·副省级城市"
  },
  {
    "region_code": "320100",
    "region": "南京市",
    "level": "市",
    "year": 2024,
    "category": "人口",
    "subcategory": "人口规模与结构",
    "indicator": "年末常住人口",
    "nature": "实际值",
    "value": 957.7,
    "unit": "万人",
    "yoy": "0.31%",
    "deadline": "",
    "responsible": "",
    "source": "2024年南京市国民经济和社会发展统计公报",
    "doc_no": "—（公开统计公报）",
    "source_url": "https://tjj.nanjing.gov.cn/bmfw/njsj/202504/t20250401_5108490.html",
    "note": "官方统计公报补录",
    "compare_key": "年末常住人口",
    "region_tier": "3·副省级城市"
  },
  {
    "region_code": "320100",
    "region": "南京市",
    "level": "市",
    "year": 2024,
    "category": "人口",
    "subcategory": "人口规模与结构",
    "indicator": "城镇化率(常住)",
    "nature": "实际值",
    "value": 87.3,
    "unit": "%",
    "yoy": "+0.1个百分点",
    "deadline": "",
    "responsible": "",
    "source": "2024年南京市国民经济和社会发展统计公报",
    "doc_no": "—（公开统计公报）",
    "source_url": "https://tjj.nanjing.gov.cn/bmfw/njsj/202504/t20250401_5108490.html",
    "note": "官方统计公报补录",
    "compare_key": "城镇化率(常住)",
    "region_tier": "3·副省级城市"
  },
  {
    "region_code": "320100",
    "region": "南京市",
    "level": "市",
    "year": 2024,
    "category": "财政",
    "subcategory": "财政收支",
    "indicator": "地方一般公共预算收入",
    "nature": "实际值",
    "value": 1596.02,
    "unit": "亿元",
    "yoy": "",
    "deadline": "",
    "responsible": "",
    "source": "2024年南京市国民经济和社会发展统计公报",
    "doc_no": "—（公开统计公报）",
    "source_url": "https://tjj.nanjing.gov.cn/bmfw/njsj/202504/t20250401_5108490.html",
    "note": "官方统计公报补录",
    "compare_key": "地方一般公共预算收入",
    "region_tier": "3·副省级城市"
  },
  {
    "region_code": "320100",
    "region": "南京市",
    "level": "市",
    "year": 2024,
    "category": "财政",
    "subcategory": "财政收支",
    "indicator": "地方一般公共预算支出",
    "nature": "实际值",
    "value": 1705.26,
    "unit": "亿元",
    "yoy": "",
    "deadline": "",
    "responsible": "",
    "source": "2024年南京市国民经济和社会发展统计公报",
    "doc_no": "—（公开统计公报）",
    "source_url": "https://tjj.nanjing.gov.cn/bmfw/njsj/202504/t20250401_5108490.html",
    "note": "官方统计公报补录",
    "compare_key": "地方一般公共预算支出",
    "region_tier": "3·副省级城市"
  },
  {
    "region_code": "440100",
    "region": "广州市",
    "level": "市",
    "year": 2024,
    "category": "经济",
    "subcategory": "经济总量",
    "indicator": "地区生产总值(GDP)",
    "nature": "实际值",
    "value": 31032.5,
    "unit": "亿元",
    "yoy": "2.1%",
    "deadline": "",
    "responsible": "",
    "source": "2024年广州市国民经济和社会发展统计公报",
    "doc_no": "—（公开统计公报）",
    "source_url": "https://tjj.gz.gov.cn/stats_newtjyw/tjsj/tjgb/qstjgb/content/post_10203416.html",
    "note": "官方统计公报补录",
    "compare_key": "GDP",
    "region_tier": "3·副省级城市"
  },
  {
    "region_code": "440100",
    "region": "广州市",
    "level": "市",
    "year": 2024,
    "category": "经济",
    "subcategory": "经济总量",
    "indicator": "人均GDP",
    "nature": "实际值",
    "value": 164171,
    "unit": "元",
    "yoy": "1.4%",
    "deadline": "",
    "responsible": "",
    "source": "2024年广州市国民经济和社会发展统计公报",
    "doc_no": "—（公开统计公报）",
    "source_url": "https://tjj.gz.gov.cn/stats_newtjyw/tjsj/tjgb/qstjgb/content/post_10203416.html",
    "note": "官方统计公报补录",
    "compare_key": "人均GDP",
    "region_tier": "3·副省级城市"
  },
  {
    "region_code": "440100",
    "region": "广州市",
    "level": "市",
    "year": 2024,
    "category": "人口",
    "subcategory": "人口规模与结构",
    "indicator": "年末常住人口",
    "nature": "实际值",
    "value": 1897.8,
    "unit": "万人",
    "yoy": "+15.10万人",
    "deadline": "",
    "responsible": "",
    "source": "2024年广州市国民经济和社会发展统计公报",
    "doc_no": "—（公开统计公报）",
    "source_url": "https://tjj.gz.gov.cn/stats_newtjyw/tjsj/tjgb/qstjgb/content/post_10203416.html",
    "note": "官方统计公报补录",
    "compare_key": "年末常住人口",
    "region_tier": "3·副省级城市"
  },
  {
    "region_code": "440100",
    "region": "广州市",
    "level": "市",
    "year": 2024,
    "category": "人口",
    "subcategory": "人口规模与结构",
    "indicator": "年末户籍人口",
    "nature": "实际值",
    "value": 1075.02,
    "unit": "万人",
    "yoy": "",
    "deadline": "",
    "responsible": "",
    "source": "2024年广州市国民经济和社会发展统计公报",
    "doc_no": "—（公开统计公报）",
    "source_url": "https://tjj.gz.gov.cn/stats_newtjyw/tjsj/tjgb/qstjgb/content/post_10203416.html",
    "note": "官方统计公报补录",
    "compare_key": "年末户籍人口",
    "region_tier": "3·副省级城市"
  },
  {
    "region_code": "440100",
    "region": "广州市",
    "level": "市",
    "year": 2024,
    "category": "人口",
    "subcategory": "人口规模与结构",
    "indicator": "城镇化率(常住)",
    "nature": "实际值",
    "value": 87.24,
    "unit": "%",
    "yoy": "+0.48个百分点",
    "deadline": "",
    "responsible": "",
    "source": "2024年广州市国民经济和社会发展统计公报",
    "doc_no": "—（公开统计公报）",
    "source_url": "https://tjj.gz.gov.cn/stats_newtjyw/tjsj/tjgb/qstjgb/content/post_10203416.html",
    "note": "官方统计公报补录",
    "compare_key": "城镇化率(常住)",
    "region_tier": "3·副省级城市"
  },
  {
    "region_code": "440100",
    "region": "广州市",
    "level": "市",
    "year": 2024,
    "category": "财政",
    "subcategory": "财政收支",
    "indicator": "地方一般公共预算收入",
    "nature": "实际值",
    "value": 1954.74,
    "unit": "亿元",
    "yoy": "0.5%",
    "deadline": "",
    "responsible": "",
    "source": "2024年广州市国民经济和社会发展统计公报",
    "doc_no": "—（公开统计公报）",
    "source_url": "https://tjj.gz.gov.cn/stats_newtjyw/tjsj/tjgb/qstjgb/content/post_10203416.html",
    "note": "官方统计公报补录",
    "compare_key": "地方一般公共预算收入",
    "region_tier": "3·副省级城市"
  },
  {
    "region_code": "440100",
    "region": "广州市",
    "level": "市",
    "year": 2024,
    "category": "财政",
    "subcategory": "财政收支",
    "indicator": "地方一般公共预算支出",
    "nature": "实际值",
    "value": 2777.43,
    "unit": "亿元",
    "yoy": "-6.5%",
    "deadline": "",
    "responsible": "",
    "source": "2024年广州市国民经济和社会发展统计公报",
    "doc_no": "—（公开统计公报）",
    "source_url": "https://tjj.gz.gov.cn/stats_newtjyw/tjsj/tjgb/qstjgb/content/post_10203416.html",
    "note": "官方统计公报补录",
    "compare_key": "地方一般公共预算支出",
    "region_tier": "3·副省级城市"
  },
  {
    "region_code": "440300",
    "region": "深圳市",
    "level": "市",
    "year": 2024,
    "category": "经济",
    "subcategory": "经济总量",
    "indicator": "地区生产总值(GDP)",
    "nature": "实际值",
    "value": 36801.87,
    "unit": "亿元",
    "yoy": "5.8%",
    "deadline": "",
    "responsible": "",
    "source": "2024年深圳市国民经济和社会发展统计公报",
    "doc_no": "—（公开统计公报）",
    "source_url": "https://tjj.sz.gov.cn/gkmlpt/content/12/12190/post_12190509.html",
    "note": "官方统计公报补录",
    "compare_key": "GDP",
    "region_tier": "3·副省级城市"
  },
  {
    "region_code": "440300",
    "region": "深圳市",
    "level": "市",
    "year": 2024,
    "category": "经济",
    "subcategory": "经济总量",
    "indicator": "人均GDP",
    "nature": "实际值",
    "value": 205714,
    "unit": "元",
    "yoy": "4.8%",
    "deadline": "",
    "responsible": "",
    "source": "2024年深圳市国民经济和社会发展统计公报",
    "doc_no": "—（公开统计公报）",
    "source_url": "https://tjj.sz.gov.cn/gkmlpt/content/12/12190/post_12190509.html",
    "note": "官方统计公报补录",
    "compare_key": "人均GDP",
    "region_tier": "3·副省级城市"
  },
  {
    "region_code": "440300",
    "region": "深圳市",
    "level": "市",
    "year": 2024,
    "category": "人口",
    "subcategory": "人口规模与结构",
    "indicator": "年末常住人口",
    "nature": "实际值",
    "value": 1798.95,
    "unit": "万人",
    "yoy": "+19.94万人",
    "deadline": "",
    "responsible": "",
    "source": "2024年深圳市国民经济和社会发展统计公报",
    "doc_no": "—（公开统计公报）",
    "source_url": "https://tjj.sz.gov.cn/gkmlpt/content/12/12190/post_12190509.html",
    "note": "官方统计公报补录",
    "compare_key": "年末常住人口",
    "region_tier": "3·副省级城市"
  },
  {
    "region_code": "440300",
    "region": "深圳市",
    "level": "市",
    "year": 2024,
    "category": "人口",
    "subcategory": "人口规模与结构",
    "indicator": "年末户籍人口",
    "nature": "实际值",
    "value": 631.01,
    "unit": "万人",
    "yoy": "",
    "deadline": "",
    "responsible": "",
    "source": "2024年深圳市国民经济和社会发展统计公报",
    "doc_no": "—（公开统计公报）",
    "source_url": "https://tjj.sz.gov.cn/gkmlpt/content/12/12190/post_12190509.html",
    "note": "官方统计公报补录",
    "compare_key": "年末户籍人口",
    "region_tier": "3·副省级城市"
  },
  {
    "region_code": "420100",
    "region": "武汉市",
    "level": "市",
    "year": 2024,
    "category": "经济",
    "subcategory": "经济总量",
    "indicator": "地区生产总值(GDP)",
    "nature": "实际值",
    "value": 21106.23,
    "unit": "亿元",
    "yoy": "5.2%",
    "deadline": "",
    "responsible": "",
    "source": "2024年武汉市国民经济和社会发展统计公报",
    "doc_no": "—（公开统计公报）",
    "source_url": "https://tjj.wuhan.gov.cn/tjfw/tjgb/202503/t20250327_2558447.shtml",
    "note": "官方统计公报补录",
    "compare_key": "GDP",
    "region_tier": "3·副省级城市"
  },
  {
    "region_code": "420100",
    "region": "武汉市",
    "level": "市",
    "year": 2024,
    "category": "经济",
    "subcategory": "经济总量",
    "indicator": "人均GDP",
    "nature": "实际值",
    "value": 153037,
    "unit": "元",
    "yoy": "4.9%",
    "deadline": "",
    "responsible": "",